name|created_utc|subreddit|title|selftext|upvote_ratio|ups|downs|score
t3_12jaejd|1681274991.0|investing|Investing in Directly in Chinese Equities|"The prices of Chinese companies often shoot up on the first day of trading. In 2017, for instance, 432 IPOs in Mainland China saw their share prices pop by c.44% on their first day of trading (the 44% cap imposed by regulators for the first day of trading prevented more dramatic pops).

Earlier this week Chinese regulators removed that cap, which saw shares in the 10 companies that listed on Monday soar by c.100% on average on their first day of trading - see [here](https://www.ft.com/content/7dcf4908-68e9-4e6e-8e42-ff7ad5e28589).

Absent further reforms and provided that you align your investment choices with CCP preferences, which are fairly easy to work out given how explicit they are, registering for A-share IPOs seems an attractive opportunity. 

The issue, however, is that I don't have a clue how to go about doing it. I would really appreciate some advice on how how to directly invest in Chinese equities, i.e., those that are listed on the Shenzhen Stock Exchange and the Shanghai Stock Exchange, from overseas (I'm based in the UK).

I could, of course, buy ADRs or invest in dual-listed Chinese companies. These do not, however, offer what I'm looking for. I want to register for Chinese IPOs on the SZSE and the SSE.

Any help very welcome."|0.29|0|0|0
t3_12j8wjd|1681271300.0|investing|Sinking fund payment on muni bond|Does the payment pay for the bond principal?   Suppose par was $1000 with yield of 4% for 10 years.   Sinking fund payment starts on year 7 paying back $100 each yearm. Then in year 7, yor principal will be $900 ( after receiving $100 sinking fund payment), and you would earn interest in $900 in year 7.  Is this how it would work?  Thanks for your help in helping me understand this.|0.5|0|0|0
t3_12j4u9s|1681262046.0|investing|Any sites or firms with good track record predicting CPI inflation of previous month?| Given that CPI data is nothing more than a defined weighted basket of goods and services which is being tracked to see how much more expensive things get every month to put it simple, aren't there any good sites or investment firms that have a good track record of predicting last month's CPI inflation data ahead of the official report release? I mean the methodology of CPI, so what's in the basket, weightings etc.. isn't classified or anything and I assume this is how investment firms calculate their estimates they hand over to Bloomberg, Reuters, etc..|0.58|2|0|2
t3_12j10jg|1681253987.0|investing|A CD turned into a DN? What does that mean?|"I opened a brokerage account recently, self-directed. I put in an order for a new issue CD and when it was executed it showing up as a DN instead of a CD. I'm not sure what a DN is or how it differs, just that it's not what I asked for. When I clicked my order, it clearly is taking me to a New Issue CD but when I look at what I have, it's a secondary CD I think? 

Basic question is just, how did this happen and if there's anything different I will need to be aware of with it finishing out and taxes?"|0.89|153|0|153
t3_12iwymc|1681245791.0|investing|Brokerage and ownership question, Etoro vs Hargreaves Lansdown|" I've been using Etoro for about 1 year now,

Though I'm becoming increasingly concerned that because of the fractional shares situation, I don't actually own my shares, etoro does, and I simply am a number on their internal Ledger system.

I'm aware that Etoro is a long standing company but could anyone give insight into what happens should Etoro go belly up? And whether I actually own the shares or not?

As an alternative I've opened an account with Hargreaves Lansdown. More expensive and old school I know, but I'm fairly certain that with them, I will fully own the rights to any shares that I purchase.

Any insights, opinions or corrections are welcome.

Thanks"|0.84|19|0|19
t3_12iuuzy|1681241670.0|investing|Thoughts on portfolio- balanced or not|"Looking to rebalance portfolio. If I am looking at long term investments (20 yrs + horizon, 32 yrs old right now), is it better to overindex on any sector to get some alpha? I want to buy healthcare and energy ETFs because I am overindexed on tech currently (work in tech and stocks vested recently), but not sure if I should just not care and match S&amp;P exposure, or overindex somewhere to get better returns. Do risk tolerant young investors overindex by sector? For how long does it make sense?

Share of equities portfolio:
Basic materials share 0.96%
Communication services 7.6%
Consumer (all) 15.8%
Energy 2.1%
Financial services 13.2%
Healthcare 11.8%
Industrials 6.9%
Tech 39.5%
Utilities 2%"|0.66|5|0|5
t3_12it6v9|1681238427.0|investing|What is happening intraday with 1 month T-bills?|"According to WSJ Bonds and Rates, the 1 month T-bill yield opened the day around 4.4% and has dropped to 4.1%. This seems incredibly aggressive for an intraday move.

Additionally, 3 month bill yields have slightly risen to over 5.00%, making the spread between 1m-3m seem abnormally wide.

Any thoughts or rationale here? Maybe bid/ask spread related for these bills?

Edit: WSJ and MarketWatch, both reporting the same yield on 1m t-bills are getting their data from TP ICAP so maybe the source has an issue with the data (?)

Edit 2: people seem to not be reading the post. Here is the data I am sourcing: https://www.wsj.com/market-data/quotes/bond/BX/TMUBMUSD01M

In addition, this would be the largest spread that I can see between these very short maturities, at almost 90bps. This leads me to believe this is some sort of anomaly in the data.

Lastly, for context, a move like this is rather unheard of, as shown here: https://fred.stlouisfed.org/graph/fredgraph.png?g=12pm6"|0.5|0|0|0
t3_12iq68f|1681232577.0|investing|Investment Strategy China Invasion of Taiwan + interefence USA|"Hi,

I am wondering what to do in the case of an invasion China in Taiwan. I see two scenarios I would like to discuss.

1. China invades Taiwan and US are not intervene

In this case I think there will be a huge drop in all stocks initially. But to make it short I think some will recover quickly like military stuff. There will be market that don´t suffer too much like industrie that is not relying on the newest semi conductor chips. Companies like ASML and wafer producer which are not in taiwan can maybe take advantage of this situation and even grow since domestic demand of non involved countries will be huge. Nevertheless this is probably still a market you want to go rather short.

2. China invades Taiwan and US and its allies intervene.

This is actually the scenario why I opened this thread. For this scenario I am sure the global market will completely collapse. Health, Automotive, Chemical, the finance sector and with it most public companies who are relying on a cash flow so, even the steel industrie and sectors that  actually could profit from a WW3 scenario.   
Only, maybe, the military sector will give some gains here. But with the finance sector going down I assume military public companies will be made private and transfered to the GOV.   
Considering the global impact and the unpredictable behavior of supervisory authority like the SEC who could freeze the stock markets completly I think its not a bad idea to keep all money away from the stock market. I could also imagne collapses of currencies like the EU since the eurozone is already instable. But these are just some guesses.

Then one could argue go in Gold. But history has shown that states can use expropriation to take such investments away from one. Some voices say, and I think maybe they have a good point here, go to a unimportant emerging country that is used to be poor and stay there with your capital till the war is over.

What do you think would be the right investments strategy for these two scenarios and why exactly?"|0.36|0|0|0
t3_12inuyu|1681227755.0|investing|Question about taxes on Treasury bills|"If I buy a 3 month Treasury bill from Treasury Direct and then hold it to maturity, how am I taxed?

* State and local: not taxed

* Federal: taxed, but how? Would the interest be counted as ordinary income, capital gains, qualified interest/dividends, or something else?

Thanks in advance."|0.85|50|0|50
t3_12ik7fn|1681220326.0|investing|How to deal with callable bonds in a bond ladder| I have a sizable number of callable muni bonds I inherited. Now that I am looking to retire, I want to set up a bond ladder. I am not sure how to handle the munis in my ladder since they are callable. I can put them at the callable date (not happening in today's market), I can put them at the maturity date and just have to deal with it if they called early, or i can sell them at a loss. Pros/cons to these options? Any other thoughts?  I am in the US.|0.77|7|0|7
t3_12ijd01|1681218516.0|investing|A question for Canadians: different RRSP/TFSA ETFs? Or VGRO in all?|I'm late 40s, new to this. Just put $1000 each in a Questrade RRSP and TFSA, will add to them regularly. I've heard it's best for tax reasons to put stocks in the TFSA and bonds in an RRSP. So based on that logic, does it make sense to go with something like VEQT in the TFSA and VCIP in the RRSP? Or is the difference negligible, and VBAL or VGRO would be fine for both?|0.75|2|0|2
t3_12iejp6|1681206070.0|investing|A question for those who are in the market for decades: was there an uncertainty in the market always?|I am new to the investing, and lately was watching YouTubers, reading blogs, twitter and all that. I can clearly see that there are group of people that says the market will go down, other group will say we will go up from now and etc. However, there are third group that says now this time everything is different. So this view that everything is different this time is bothers me. What is different? What it is different? What is your view on this?|0.86|351|0|351
t3_12idt2f|1681203670.0|investing|Daily General Discussion and Advice Thread - April 11, 2023|"Have a general question?  Want to offer some commentary on markets?  Maybe you would just like to throw out a neat fact that doesn't warrant a self post?  Feel free to post here! 

If your question is ""I have $10,000, what do I do?"" or other ""advice for my personal situation"" questions, you should include relevant information, such as the following:

* How old are you? What country do you live in?  
* Are you employed/making income? How much?  
* What are your objectives with this money? (Buy a house? Retirement savings?)  
* What is your time horizon? Do you need this money next month? Next 20yrs?  
* What is your risk tolerance? (Do you mind risking it at blackjack or do you need to know its 100% safe?)  
* What are you current holdings? (Do you already have exposure to specific funds and sectors? Any other assets?)  
* Any big debts (include interest rate) or expenses?  
* And any other relevant financial information will be useful to give you a proper answer.  

Please consider consulting our FAQ first - https://www.reddit.com/r/investing/wiki/faq
And our [side bar](https://www.reddit.com/r/investing/about/sidebar) also has useful resources.  

If you are new to investing - please refer to Wiki - [Getting Started](https://www.reddit.com/r/investing/wiki/index/gettingstarted/)

The reading list in the wiki has a list of books ranging from light reading to advanced topics depending on your knowledge level. Link here - [Reading List](https://www.reddit.com/r/investing/wiki/readinglist)

Check the resources in the sidebar.

Be aware that these answers are just opinions of Redditors and should be used as a starting point for your research. You should strongly consider seeing a registered investment adviser if you need professional support before making any financial decisions!"|0.78|19|0|19
t3_12icflx|1681199117.0|investing|Investing in Turkey with high inflation|Does it make sense to invest in the cheap market in Turkey due to high inflation? I foresee a 700% increase like Argentina. You all remember that a great rise started when the Argentine economy priced in inflation. I think the same increase will happen in Turkey. Moreover, a change of government is also envisaged. Can I have your comments on this topic?|0.24|0|0|0
t3_12i78ah|1681184539.0|investing|Selling cash secured puts through Fidelity will also earn me interest on the cash sitting in the account?|"So Fidelity pays a bit over 4% on cash in your brokerage account. Let's say if I were to sell a cash secured put, then I would also be earning interest on the cash set aside for that put, right?

Or is this a special case where that money will not be earning interest?"|0.54|1|0|1
t3_12i2vzo|1681174498.0|investing|What are the potential downfalls of limit order/limit selling a stock/cryptocurrency?|"I’m specially talking about bitcoin. There’s so much fluctuation between $26-30k that I was wonder what is the cons are of setting a limit order at a price in the lower range and then setting a limit sell after that order is fulfilled and just doing this over and over to slowly gain profit?

Sorry if this is a super amateur question. I’m just spitballing ideas to make profit off of volition price movement."|0.62|7|0|7
t3_12i2hzu|1681173609.0|investing|First Solar is poised to outperform for the rest of the decade|It can be cheaper to build and run a solar plant than it is to buy gas for an existing natural gas power plant. First Solar provides the PV solar panels that are used for large-scale utility installations. The company has a large backlog, which will take multiple years to work through. It looks like a winning stock for the remainder of the 2020s.|0.35|0|0|0
t3_12i13fw|1681170517.0|investing|How To Calculate a Business Owner's Net Worth?|"Everyone knows that to calculate a company's [enterprise value](https://www.wallstreetoasis.com/resources/skills/valuation/what-is-enterprise-value-EV), you add the equity and net debt values. Say a company's [equity value is 6](https://www.wallstreetoasis.com/resources/skills/valuation/what-is-equity-value) billion and has 4 billion in net debt, the [total enterprise value](https://www.wallstreetoasis.com/resources/skills/valuation/what-is-enterprise-value-ev) is 10 billion.

But say the company is 100% owned by one individual. In [calculating his net worth](https://www.wallstreetoasis.com/resources/skills/valuation/net-worth), would the calculation be to subtract net debt from equity value, meaning his net worth would only be 2 billion?

So in this case, the company would be ""worth"" 10 billion but the owner is only worth 2 billion?"|0.57|3|0|3
t3_12i04yq|1681168563.0|investing|Future option settle time?|"I have found some information related to future option (I am thinking about trading option on ES).

So basically there is no need to keep $25k on the account for day trading future option, correct?

How long does it take to settle ES option (sell to close)? Does it take same time as sell to close SPX option?

Thanks

\--------------------

[https://tlc.thinkorswim.com/center/howToTos/thinkManual/Miscellaneous/Margin/Pattern-Day-Trading.html](https://tlc.thinkorswim.com/center/howToTos/thinkManual/Miscellaneous/Margin/Pattern-Day-Trading.html)

**Are Futures or Forex subject to the PDT rules?**

Both Futures/Futures Options and Forex are regulated by the NFA, which has no rules on day trading. As such, Futures/Futures Options and Forex round trips don't count toward the PDT rules and funds covering margin on Futures/Futures Options and Forex positions don’t count toward the $25,000 FINRA equity requirement."|0.5|0|0|0
t3_12hxbd7|1681162900.0|investing|Brokerages need to offer better MFA token options|"Most every service I use that needs MFA can use a TOTP app like Google/Microsoft Authenticator or FreeOTP or whatever. Or you can use a physical token. That is the goal.

But both Schwab and Fidelity require phone based MFA or some crapware semantics you install on your phone. They offer neither TOTP, nor physical tokens.

Vanguard offers phone based or physical tokens, but not TOTP!

RobinHood is the opposite, offering phone based and TOTP based, but not physical tokens.

I just want a nice brokerage that offers a checking account, and doesn't make me install an app on my phone or use my phone for MFA in any way. Is that too much to ask?"|0.79|43|0|43
t3_12htagr|1681154977.0|investing|Can I use a Box Spread to get around margin loan restrictions during IPO lock-up Period?|"If an IPO's lock-up terms prevent pledging shares/using shares as collateral for margin/pledged asset loans, can this be circumvented usign a Box Spread on SPX options?

Basically a box spread uses offsetting options contracts to create a synthetic loan. Would this get around the IPO restrictions since the options aren't involving my company stock (rather spx options), and this technically wouldn't be an actual loan, just an options strategy that replicates a loan?"|0.5|0|0|0
t3_12hrtq7|1681152080.0|investing|Auditors Didn’t Flag Risks Building Up in Banks, Bond losses such as those at Silicon Valley Bank could have been raised as ‘critical audit matters’|"From the wsj: https://www.wsj.com/articles/auditors-didnt-flag-risks-building-up-in-banks-6506585c

&gt;When KPMG LLP gave Silicon Valley Bank a clean bill of health just 14 days before the lender collapsed, the Big Four audit firm flagged potential losses on loans as a so-called critical audit matter. But the audit opinion was silent on what actually brought down the bank—its unrealized bond losses and ability to hold them given a reliance on potentially flighty deposits.

&gt;“The auditors failed to mention the fire in the basement or the box of dynamite on the first floor, but they did point out the peeling paint on the flower box,” said Erik Gordon, a University of Michigan business professor. “How could they miss the interest-rate risk?”

&gt;The current banking crisis is the first big test of critical audit matters, a measure designed to help investors decode risks and uncertainties buried in financial statements. 

&gt;Audit regulator Public Company Accounting Oversight Board introduced critical audit matters in 2017 to “breathe life into the audit report.” Described as the biggest shake-up in audits in 70 years, the new standard was meant to make audit opinions more useful to investors.

&gt;So far, though, critical audit matters have failed to shed light on issues that have caused a collapse of confidence among depositors and investors in many small and midsize banks.

&gt;Auditors are required to record any critical audit matters when they sign off on a public company’s books. Regulators define these as matters that have a significant impact on the financial statements and involve “especially challenging, subjective or complex” judgments by the auditors.

&gt;Silicon Valley Bank’s unrealized losses in its bond portfolio appear to “meet every definition of a possible critical audit matter,” said Martin Baumann, a former chief auditor at the PCAOB who had a leading role in designing the new measure.

&gt;The latest banking crisis has exposed the gamble some banks took in betting heavily on long-term government bonds, which last year plunged in value as the Federal Reserve raised interest rates. 

&gt;Banks can keep these losses off their books by classifying their bondholdings as “held to maturity,” or intended never to be sold, allowing them to be held at cost rather than fair value. The banking industry last year relied more heavily on this accounting maneuver, as rising rates pummeled balance sheets.    

&gt;Accounting rules say banks can classify bonds as held to maturity only if they have both the intent and ability to hold on to them, rather than having to sell them to meet demands for withdrawals. For well-capitalized banks, that likely isn’t a tough judgment call to make.

&gt;But it is a much more nuanced issue for many of the lenders at the center of the latest banking crisis. Unlike the biggest banks, smaller banks are largely reliant on deposits for funding, which can prove flighty in stressed times, calling into question a bank’s ability to indefinitely hold long-term assets.

&gt;The parent of Silicon Valley Bank, SVB Financial Group SIVBQ had $91 billion of held-to-maturity bonds on its Dec. 31 balance sheet, which a footnote said had a fair value of just $76 billion. That $15 billion loss was big enough to wipe out most of the bank’s total equity of $16 billion at year-end.

&gt;The lender’s total deposits had shrunk from the previous year, its financial statements showed. What’s more, its reported cash was only around 8% of total deposits, heightening the risk it would need to sell long-term assets if significant numbers of its depositors left. 

&gt;That appears to tick all the boxes for the auditor to highlight this issue as a critical audit matter. “The judgment as to whether or not Silicon Valley Bank had the ability to hold these securities to maturity was certainly a complex question, it was material to investors, and it is hard to see how liquidity was not a matter for discussion with the audit committee,” said Mr. Baumann, who is also a former senior partner at Big Four audit firm PricewaterhouseCoopers. 

&gt;“I’m not the auditor of the bank and I don’t know if this [bonds issue] should have been included in the auditor’s report,” he added. “But as the lead author of the standard, this certainly is the kind of item that we had in mind for critical audit matters.”

&gt;Representatives of the accounting industry pushed back on suggestions auditors should have sounded the alarm ahead of the crisis. Dennis McGowan, vice president of professional practice at the Center for Audit Quality, said accounting standards don’t require companies to anticipate “extremely remote” scenarios in deciding whether they can classify bonds as held to maturity. 

&gt;“Some of what’s happened could not have been anticipated. Social media fueled the withdrawals from one bank, for example,” Mr. McGowan said. “Auditors don’t have a crystal ball to anticipate that kind of thing.”

&gt;KPMG’s audit of Silicon Valley Bank could be tested in court if shareholders decide to include the firm in the likely lawsuits. 

&gt;“The lack of a relevant critical audit matter and of a going concern are going to come up if it comes to litigation,” said Jack Castonguay, an accounting professor at Hofstra University. He added that it was difficult to judge KPMG’s audit without seeing the firm’s work papers or knowing what risks it discussed with SVB’s audit committee.

&gt;A KPMG spokesman declined to comment. In response to a request for comment to SVB’s successor bank, a spokeswoman for the Federal Reserve cited the regulator’s description of the bank’s failure as a “textbook case of mismanagement.” She declined to comment on KPMG’s audit of the lender. 

&gt;Do you think changes should or will be made to the way banks are audited as a result of the collapse of SVB and Signature? Join the conversation below.

&gt;Auditors’ apparent blind spot on the interplay of interest-rate and liquidity risks isn’t confined to Silicon Valley Bank. 

&gt;Auditors for nine other U.S. banks most exposed to bond losses also didn’t flag this as an issue when they signed off on the financial statements for 2022, according to an analysis by The Wall Street Journal

&gt;The Journal reviewed the audit opinions for the 10 small to midsize U.S. banks that last year reported the highest losses on held-to-maturity securities as a proportion of their shareholder equity, based on data from research-firm Calcbench. Silicon Valley Bank ranked second on the list. 

&gt;None of the auditors included a critical audit matter related to the bank’s treatment of the bonds. Instead, nine of the 10 reported a critical audit matter for estimated losses from loans or other bad debts. That is the risk that brought down banks in the 2008 financial crisis. Auditors didn’t report any critical audit matter for one of the banks, the analysis found.

&gt;A PCAOB spokeswoman declined to comment on whether the lack of critical audit matters related to the latest crisis was a reflection of the effectiveness of the measure. 

&gt;“Unfortunately CAMS have not been used as fully as we had hoped for,” the former regulator Mr. Baumann said."|0.88|278|0|278
t3_12hre3i|1681151210.0|investing|I still don't understand the point of bond ETFs|"When I buy a bond, I intend on holding it until it expires, gaining interest and my original investment.

I can't do that with a bond ETF, if I buy one, I should basically hope that I can sell it at a higher price in the future, which is basically a bet that interest rates will be lower.

(I know that bond ETFs pay interest, but that would hardly cover my principal loss if interest rates were to soar and the ETF drops 30-40% in price)

Why are bond ETFs considered low risk? It seems to be riskier than stock ETFs to be honest..

How can I implement my buy-until-expiration strategy using bond ETFs?

Thanks in advance."|0.93|607|0|607
t3_12hqu43|1681150075.0|investing|Anyone have T-bills maturing in June and July?|"Sorry if this has been discussed to death. 

I have ~200k split between snsxx and tbills that are maturing in June and July. I’m starting to wonder if it’s rational to even take the slight risk of debt ceiling default.

I could move snsxx to a short term cd and get the fdic insurance. Not much I can do with what’s parked in T-bills besides selling them at discount and then doing the same.

Anyone else in a similar situation? What are you doing to prepare for the unlikely scenario of treasury default."|0.62|8|0|8
