name|created_utc|subreddit|title|selftext|upvote_ratio|ups|downs|score
t3_128ahi1|1680321626.0|investing|Series I Calculation Error?|"Issue Date: 03-01-2022

Amount: $10,000.00

Current Amount: $10,604.00

Shouldn't this be $10,837? The initial 6 mo rate was [7.12%](https://www.treasurydirect.gov/news/2021/release-11-01-rates/) and the next 6 mo rate was [9.62%](https://www.treasurydirect.gov/news/2022/release-05-02-rates/) for an average of 8.37%. Why is it $604?"|0.44|0|0|0
t3_12834pg|1680304179.0|investing|Reminder that it's okay to be wrong, and don't be afraid to have others check your work!|"Hey all,

I got to be the one wrong to day, and wanted to remind others it's okay to be wrong to.

Had an investment that, per my model, was looking to bring in over 13% IRR.

Then I talked to some bankers, and found out that the rate and timeframe I used were not accurate for the current market.

That turned my 13% to...severe losses.

And that's okay. I chose to instead of going (very) wild about what looked like an amazing deal, let others look at it, and suggest areas it may be wrong, and led me to the right people to talk to to get the facts.

Still sucks but hey I didn't lose 1.5 Mil of someone elses money, so I count that as a win.

Edit: Clarification that this is Real Estate"|0.85|66|0|66
t3_127zbbx|1680296487.0|investing|Do I lose money in this scenario to taxes? (Stock purchases)|So lets say I have been buying a stock slowly for over a year like 200 shares every month.  After about two years Robinhood shows that my average purchase price for the shares is $9 per share.  Now the stock drops to $7 dollars.  So I now purchase shares equivalent to the amount I own to bring the average purchase price to $8 dollars per share.  Next month the share price goes back up to $8 per share.  I choose to sell all my shares and break even.  Will I lose money to taxes in this scenario? Since the stocks I purchased recently would be taxed more right?|0.79|8|0|8
t3_127y5rj|1680294555.0|investing|ChatGPT: The Future of Investment Analysis? Our Experiment and Results|"We've been exploring AI language models like ChatGPT for investment analysis and thought we'd share our findings. Our team was curious to see how ChatGPT would perform against our model ensemble, so we put it to the test!

**Experiment Setup**

We designed a prompt to have ChatGPT generate financial analysis with a grade score and a confidence level from 0 to 1. After some prompt engineering, we got the desired output format. We then extracted the grade and confidence score using regex.

Here's an example of ChatGPT's outputs:

Grade: B. Confidence: 0.8. Market Axess Holdings Inc. has a robust business model, boasting a leading electronic trading platform in fixed-income markets. The company consistently pays dividends and has authorized multiple share repurchase programs. However, the lack of intrinsic value metrics, such as free cash flow yield and profit margin, prevents a higher grade.

**Evaluation Framework**

We integrated ChatGPT into our evaluation framework, which utilizes a train/validation/test structure, crucial for machine learning with price as a label by quintiles. This method ensures reliable model performance on unseen data and prevents overfitting. We discovered that ChatGPT's performance depends heavily on one critical parameter – the temperature, which influences output randomness.

In our case, we used data from approximately 500 companies, with 450 texts for training, 50 for validation, and 50 for testing. We trained our model using the 450 samples, evaluated and tuned the model with the validation set, and assessed the model's performance using the 50-sample test set. This approach minimizes overfitting and offers a dependable estimation of the model's performance on new, unseen data. For our in-house product-level model, we've optimized and frozen the model hyperparameters, using the validation set only for model selection. In our comparison, we evaluated the test set performance of our model against GPT-3.5 Turbo.

**Discussion**

Here is the figure summarizing the results [https://github.com/leotam/leotam.github.io/blob/master/assets/stdMar-29temp.jpg](https://github.com/leotam/leotam.github.io/blob/master/assets/stdMar-29temp.jpg). On the horizontal we have increasing temperature from 0 to 1, meaning more randomness and possibly creativity at higher ends. On the vertical, we have the MCC and accuracy. We can see that they have a rough correlation- a higher MCC will naturally have a higher accuracy. We'd expect a MCC of 0 to be equivalent to random chance which would imply an accuracy of 20% for quintiles. On the chart we can find the best GPT temperature setting was 0.6 which gave 25% accuracy or 5% above random chance. The corresponding MCC value was 0.026.  We can compare one of our strong model ensemble at 39.1% accuracy or 57% greater accuracy than the best GPT model.

It's important to note that we were limited to 4097 tokens for the GPT 3.5 turbo model (a close cousin of ChatGPT), while our models read up to the required 200k tokens per company. We also didn't use the more advanced GPT-4, which supports longer context up to 32k tokens, but at a much higher inference cost and time. GPT has a natural user interaction, and RLHF has an even more enticing prospect.

We found that ChatGPT has the potential to be a useful tool for investment analysis, but its performance can vary depending on the temperature parameter.

Here's a detailed write-up: [https://leotam.github.io/general/2023/03/30/chatgpt.html](https://leotam.github.io/general/2023/03/30/chatgpt.html)

A youtube video with a few more tidbits: [https://www.youtube.com/watch?v=0J4eYgLA\_SY](https://www.youtube.com/watch?v=0J4eYgLA_SY)

Let me know what you guys think!"|0.79|160|0|160
t3_127v9w6|1680288889.0|investing|What if Google bought TikTok?|"I mean, let's face it, most young people don't even bother googling stuff these days. They're too busy scrolling through TikTok and Instagram. Not only that, some of us just prefer to watch a short video explaining something rather than reading a 500 words SEO friendly article (which in the future will just be a copy paste from ChatGPT etc).

Not too long ago, the idea of Google buying TikTok seemed far-fetched, and would have probably been blocked by authorities. However, given the ongoing concerns around data privacy and the app's Chinese ownership, such a move could be seen as a smart and even patriotic move by Google.

By acquiring TikTok, Google could potentially save the app from being shut down, secure our data, while saving their business and their public image."|0.31|0|0|0
t3_127uqp3|1680287812.0|investing|Paper stock certificate in a company that was bought out (Lucent Technologies)|"Lucent Technologies is a company I used to invest in and follow back in the old days.  Someone posted a paper certificate for old Lucent Technologies shares that they had.  

It got me thinking.  I know Lucent Technologies was merged with Alcatel to form Alcatel-Lucent and investors got 0.1952 shares of ALU per share of LU.  Eventually, Alcatel-Lucent was bought by Nokia and 1 share of ALU got you 0.55 shares of Nokia.  

Way back when (2006 I believe?) LU shareholders were supposed to turn in their LU stock for ALU.  If that wasn’t done back when the merger happened and the company (ALU) is now defunct, does a paper Lucent Technologies stock certificate hold any value anymore?"|0.82|13|0|13
t3_127tvj5|1680286097.0|investing|U.S Index Funds are the Way to Go|"\&gt;Positive birthrates, less reliance on immigration compared to nearly every other rich nation

\&gt;Lots of arable land for expansion

\&gt;When isolating for useful land, it is largest country on the planet

\&gt;High on the natural resource spectrum

\&gt;Very high economic growth

\&gt;Rising average wages

\&gt;Rising productivity/capita

\&gt;Still the technological epicenter of the world (i.e ChatGPT, Microsoft, Apple, META, Nvidia)

\&gt;Still financial capital of the world (J.P Morgan Chase, Goldman Sachs, Citibank, Morgan Stanley)

\&gt;Biggest cultural exporter (Hollywood, Madison Avenue, Twitter, Youtube)

\&gt;Brand monopoly (Nike, MacDonalds, Ford)

\&gt;Largest military in the world

\&gt;Largest military industrial complex in the world, meaning we can sustain our military in case of a war (Lockheed Martin, Raytheon).

\&gt;Food independent, net exporter of food, China is a net importer, meaning they're dependent

We're entering into a De-Globalization period which yes, will lower our standard of living as products formerly made overseas will rise relative to our income. This is the natural consequence of protectionism. However, we are still in a better position relative to China and Russia, which will suffer Demographic and economic problems for decades to come.

China has already maxxed out its one advantage. High population. With 1 billion people, even marginal increases in per-capita productivity can yield huge results. However, they're slowing down in this regard, and as the % difference in population between the U.S and China shrinks, the U.S's relative position will only strengthen.

The Ukraine war is absolutely nothing for the United States. The U.S taxes are very low compared to other nation-states, so the 900 billion we're sending to Ukraine makes up a huge hunk of the budget, but compared to our overall economic aggregate, it's NOTHING."|0.48|0|0|0
t3_127t8lx|1680284858.0|investing|Where to find real-time bond data ?|"Looking for a website that shows real time (or near real time) date for the bond market (government/corporate bonds). 

Screeners are great but when you go and try to buy the bond there is no volume or the price is completely of on what the screener was showing

Thanks in advance !!"|0.64|3|0|3
t3_127pnir|1680277732.0|investing|US Banks Have $620 Billion of Unrealized Losses on Their Books, Most banks are strong enough to withstand the paper losses. Still, their finances could be squeezed for years to come.|"From bloomberg, there is excellent graphics in the article I would recommend viewing: https://www.bloomberg.com/graphics/2023-svb-exposed-risks-banks/?srnd=premium#xj4y7vzkg

&gt;The investment losses that helped take down Silicon Valley Bank are a problem, to one degree or another, across the US financial system. In total, the industry ended last year with $620 billion of unrealized losses on its books from investments in low-yielding bonds.

&gt;For most banks, the issue is manageable.

&gt;Bonds held in investment books represented less than a quarter of the banking system’s $23.6 trillion of assets in December, and unlike SVB, lenders usually have a wide array of depositors who are unlikely to all need money around the same time. For the biggest banks, the risks are even smaller. They are perceived as too big to fail. What’s more, the recent rally in the Treasury bond market — sparked, ironically, by the jitters about the health of the banking industry — is helping to shrink the $620 billion of paper losses. (In the coming weeks, banks will start to post first-quarter data.)
Banks’ Equity Could Take Hit If Paper Losses Had to Be Realized
For most banks, unrealized losses are a manageable problem. But investors and depositors remain jittery about lenders sitting on huge piles of money-losing bonds

&gt;And yet as depositors keep gradually withdrawing their money and shifting it into money market funds and other investments, banks are facing a squeeze. They’re being pressed to pay more for funding while their revenue is limited by the investments they made in low-yielding bonds during the pandemic. That in turn could curb their ability to lend to consumers and businesses, slowing the economy.

&gt;“They’re paying more for deposits, and their earnings on bonds are fixed,” said Stan August, a retired bank examiner for the Federal Reserve Bank of Richmond and a former bond analyst at Bank of America. “That’s where the squeeze is.”

&gt;When the pandemic hit, and the Federal Reserve pushed down rates once again by pumping unprecedented amounts of cash into the economy, many banks loaded up on long-term government and mortgage-backed bonds. There were some Treasury notes that promised to pay annual interest of just 0.6% over 10 years.

&gt;Then inflation surged and the Fed started urgently driving up interest rates. The value of those bonds plunged, because who would want to buy an old bond paying 0.6% interest when new ones were suddenly paying more than 3%?

&gt;Losses on bonds are a risk whenever rates go up, but banks’ holdings were bigger than usual in 2022. All that cash the Fed and the government pushed into the economy quickly found its way into the banking system, giving lenders trillions of dollars to invest. SVB’s domestic deposits, for instance, rose more than 150% from the end of March 2020 through the end of 2022.

&gt;Rising deposits on their own don’t necessarily represent a problem for banks. For SVB, they spelled trouble in part because its clients tended to keep large balances at the bank as a condition for receiving services like lines of credit.

&gt;That translated to a high percentage of customers’ deposits being bigger than US deposit insurance limits. Clients with high balances at a bank are often skittish about the safety of their funds. and more likely to withdraw money fast at signs of trouble.

&gt;There were at least three data points for SVB that worried depositors: the speed at which the bank’s deposits had grown, the high percentage of uninsured deposits it had, and the magnitude of losses relative to its equity. These factors helped create a perfect storm.

&gt;But even for banks that dodge the storm, bond losses are a problem. A large part of banks’ investment portfolios use an accounting method called “held to maturity” that ensures the firms don’t have to record any losses, or any hits to their balance sheets, from the declining value of their bonds. But they also have to hold onto the bonds until they mature.
Banks Locked Up Trillions in Long-Term Investments
Total holdings, at amortized cost, in held-to-maturity securities for banks with at least $25 billion in assets as of Q4 2022

&gt;As banks’ deposits started to grow during the pandemic, they initially plowed more money into bonds using a method of accounting called “available for sale.” For these securities, changes in the value of the bonds would affect their balance sheets but not their income statements. That accounting method can force banks to boost their capital levels, though, if their losses get too high.

&gt;In 2021, a growing group of banks believed the Fed would soon begin raising interest rates and began switching to counting more of their bonds as held-to-maturity. The biggest banks added about $1.7 trillion of the bonds to their books over the two years ended in December. In some cases, they switched bonds over from one accounting treatment to the other. In other cases, they just stopped buying new available-for-sale securities and only added to their held-to-maturity books.

&gt;Initially it worked pretty well. Profits ballooned. The US banking system’s return on equity, a measure of profitability, averaged 12.2% in 2021, the highest since 2006.

&gt;But now that inflation and rate hikes have come, banks have suddenly been finding themselves pressured from two sides. Higher interest rates forced banks to pay more money to win deposits, with average one-year CD rates rising to about 2.7% by March, according to DepositAccounts, from 0.35% in May 2022. Consumers and companies have been taking more of their money out of banks and investing it in assets like government bonds. Deposits in commercial banks fell last year for the first time since 1948, according to the FDIC. The worst pain here is for community and regional banks, which lost $109 billion of deposits in the week ended March 15, while the biggest banks have been luring funds.

&gt;Meanwhile, the value of banks’ bond holdings plunged on paper too. The $620 billion of unrealized losses in the system at the end of 2022 were for available-for-sale and held-to-maturity securities.

&gt;The combination of surging interest rates, high investment losses and heavy deposit outflows is new for most investors and executives in the banking industry. To many, this feels like uncharted territory.

&gt;“I have covered this industry for 20 years plus and I have never seen anything like this,” said Ania Aldrich, an investment principal at Cambiar Investors. “In all the stress testing we have done for at least the largest banks have never stressed for anything like this.”

&gt;Comments from banks

&gt;Charles Schwab Bank &amp; Charles Schwab Premier Bank

&gt;“Focusing attention on ‘unrealized losses’ in our held-to-maturity (HTM) portfolio is very misleading. These ‘paper losses’ are unrealized and would only be realized if we had to sell those securities. The profile of our depositors is very different from regional banks. Given our significant access to sources of liquidity, there is a near-zero chance we’d need to sell any of our HTM portfolio prior to maturity. That would be akin to assuming a large retail bank would sell a substantial portion of its loan portfolio... Client deposits may move, but they are not leaving the firm. As is the case in every cycle, clients make choices about where to best allocate their assets. As interest rates have increased over the last year, our clients have made choices to reallocate assets within their Schwab portfolios, to reflect their preferences in this market. And in fact, we have actively encouraged them to do so. The important point is that those allocation decisions result in the assets staying at Schwab. Despite the events of the last two weeks, we have not seen any meaningful change in client behavior regarding their cash… Comparing unrealized losses across firms with different business models can be misleading. Schwab Bank has a different business model than traditional banks. Our deposits come from transactional cash in clients’ brokerage accounts that is swept to our banks. We use about 10% of that cash to fund loans to our existing clients and with the remaining 90%, we buy securities – the vast majority of which are backed by the U.S. Government. With rates moving up, the fair value of all fixed rate assets — loans or securities — has gone down. But given that our securities are very high quality, we fully expect our securities to reach par at maturity, which means the unrealized ‘paper’ losses will decrease over time. Because a much higher percentage of our assets are securities — and traditional bank loans are not disclosed the same way — our paper losses may appear larger than those of traditional banks. But that assessment lacks the appropriate context. In reality, our portfolio has less credit risk and is actually less sensitive to changes in interest rates than many large banks,” Co-Chairmen Charles Schwab and Walt Bettinger said in a statement.

&gt;First National Bank of Pennsylvania

&gt;“Due to FNB’s conservative balance sheet and interest rate risk management leading into this higher rate environment, the duration and fair value marks of our AFS and HTM portfolios were more favorable than others in the industry. Even after fully incorporating these marks into our Common Equity Tier 1 Ratio, we would remain well capitalized. In addition, FNB has a stable and granular deposit base and maintains a strong liquidity position with uninsured deposits excluding fully collateralized balances at only 27% and has available funding sources in excess of those balances,” CEO Vincent J. Delie, Jr. said in a statement.

&gt;Prosperity Bank

&gt;“Prosperity Bank has a fortress balance sheet that is well suited for times like this. In fact, we were a source of strength in the 80’s and 2008, participating in six FDIC assisted transactions. We are a traditional community bank with a diverse loan portfolio and a granular deposit base amongst the many communities that we are in. We have close to 800,000 deposit accounts with an average balance of $36,000, our uninsured and uncollateralized deposits only make up 32% of our total deposits, we have access to large amounts of liquidity, and we are extremely well capitalized. We maintain higher tangible common equity ratios than many of the large money center banks and remain well capitalized even if you include any unrealized losses in the held-to-maturity portfolio. It has been our pleasure to serve the communities we are in and help our customers navigate and understand all that is happening in the banking markets,’’ Cullen Zalman, senior vice president for banking and corporate activities at Prosperity Bank, said in a statement.

&gt;USAA Federal Savings Bank

&gt;“USAA is a fundamentally different bank than those that have struggled over the past few weeks. Our bank is consumer based, 93% of deposits are within the applicable FDIC insurance limits, and we have access to substantial liquidity to serve the needs of our members. USAA FSB also goes through rigorous stress testing to help us best support our members. Focusing on any single asset class is misguided, given additional ways to evaluate bank balance sheets, like net interest trends, which highlight the efficiencies or inefficiencies across a bank’s entire balance sheet. The degree of changes in USAA’s unrealized bond holdings is a reflection of a relatively low loan-to-deposit ratio, which means investments are a larger part of our balance sheet and accounting value fluctuations are more noticeable. But not all banks and not all investment portfolios are the same. Unrealized bond losses do not create excess risk in institutions with a stable base of customers, a strong capital position, the ability to hold such bonds to maturity and access to the liquidity necessary to meet their depositors’ and borrowers’ needs.”
First-Citizens Bank &amp; Trust Co.

&gt;“First Citizens is a well-capitalized bank, and our post-acquisition capital ratios remain within or above our target ranges. In addition, the transaction is structured to maintain our position of strength with ample liquidity and credit loss protections. Our liquidity remains strong and stable driven by conservatively managed investment portfolio, and it is enhanced by this transaction.” First-Citizens Bank &amp; Trust Co. acquired Silicon Valley Bank from the Federal Deposit Insurance Corp., though the sale did not include $90 billion in securities and other assets.
Huntington National Bank

&gt;“Per the company’s 10K, 68% of deposits at Huntington are insured / 32% are uninsured as of December 31, 2022. This is the lowest % of uninsured deposits among all US based publicly traded banks with $50bn+ in deposits (excluding those classified primarily as card issuers). Huntington has an active hedging program for securities, and total FV marks net of hedges for all securities are in line with peers.”

&gt;Northern Trust Co.

&gt;“Northern Trust is a global provider of wealth management, asset servicing, asset management and banking to corporations, institutions, and individuals. Northern Trust has offices in the United States as well as 23 locations in Canada, Europe, the Middle East and the Asia-Pacific region… Our clients leave large amounts of deposits with us not because we offer higher rates, but because they have significant payment activity. Over 60% of our institutional deposits are considered operational by regulatory standards… Northern Trust’s business model focuses on two core markets: institutions and wealthy individuals/families. These have been our historic strengths for generations. Retail banking represents a small percentage of our client base and an even smaller percentage of our assets on deposit, which in part accounts for the low percentage of insured deposits when compared with other banks that have significantly larger retail portfolios. Northern Trust is a Category II institution under the Federal Reserve’s regulatory framework. As a result, we are the only non G-SIB required to do daily liquidity testing and report unrealized losses in regulatory capital reporting. We consistently are assigned the highest long-term credit rating of any comparable U.S. institution. Northern Trust maintains a high-quality securities portfolio. Highly liquid assets constitute 62% of total client deposits as of Dec. 31, 2022. 81% of Northern Trust’s securities portfolio is composed of U.S. Treasury, government sponsored agency and triple-A rated securities. Regarding unrealized, mark-to-market HTM investment security losses as a percentage of tangible equity, it is important to note that our balance sheet composition has a lower proportion of loans, and thus our investment securities portfolio will be larger on both an absolute and percentage basis than banks with similar asset sizes.”

&gt;Banks that declined to comment:

&gt;Bank of America, First Republic Bank, JPMorgan Chase Bank, Truist Bank, US Bank, Valley National Bank and Wells Fargo Bank
Banks that didn’t respond to requests for comment or did not have immediate comment when reached:

&gt;Associated Bank, City National Bank, Manufacturers &amp; Traders Trust Co., Santander Bank, Signature Bank, Simmons Bank, State Street Bank &amp; Trust Co., UBS Bank USA and Webster Bank"|0.93|1484|0|1484
