name|created_utc|subreddit|title|selftext|upvote_ratio|ups|downs|score
t3_12wdiqt|1682262705.0|investing|Vanguard Digital Advisor (roboadvisor) vs. Vanguard Personal Advisor|"Hello all,

I currently have an IRA with Vanguard’s Digital Advisor (minimum $3k) for the last few years and have been generally happy with their product.  I am 40 years old and am not a particularly savvy investor.  I keep an eye on things, but generally feel like this should be a set it and forget it kind of thing.  I do not invest in individual stocks and am happy being aggressive with indexed funds and my Digital Advisor’s settings reflect that.  

I do have other investments elsewhere, and this is not my sole retirement plan.  

Just for information, but I don’t have the time or interest to actively manage this myself.  I realize that I could “save” by being proactive, but I am sticking with the adage “do what you do best and contract out the rest” on this matter.  In general, I don’t have an issue paying more for services that are worth it.  

I was pinged by Vanguard when I logged in to their Personal Advisor Services (minimum $50k).  I see they charge more, but I have no idea if it would be worth it to upgrade to the Personal Advisor Services.

Thank you!"|1.0|1|0|1
t3_12wd5ic|1682262376.0|investing|Will Treasury ETFs Crash in Case of a Default? - Specifically Floating Rate Notes?|"I currently have +$100k in USFR - an ETF of floating rate treasury notes. But I'm thinking of pulling it out because if worries about the debt ceiling get too high and the market falls, my ETF will probably fall as well, and I won't have my ""dry powder"" to throw into market when it's down.

Is my thinking correct?"|1.0|2|0|2
t3_12wbtr3|1682261163.0|investing|Cost differences and legal implications when investing as a resident of multiple countries?|"Hi all,

I'm a 23-year-old that wants to get into investing. I have 5500 USD available left behind by my grandfather through inheritance. I'm aiming to invest it all into an S and P 500 index fund. To make an account I need to specify my main country of residence.

I travel a lot between the UAE and UK due to my being a resident of both countries. However, I'm graduating college this summer and have a job offer confirmed for London. Would it be better to make an investment account stating the UAE as my country of residence so I can pay less in taxes? I can legally declare that I'm a resident of that country. I don't really know anything about stocks and even less about trading stocks from abroad. My father mentioned to me that it might get a little spicy if a year later I get asked by the financial authority where I'm currently working but he wasn't too sure about it."|1.0|5|0|5
t3_12w9xw0|1682258976.0|investing|Diversifying my investments with affiliate website shares - anyone else tried this?|"Hey everyone! I've been part of this community for a while and learned a lot from all of you. So, I thought I'd share my recent experience with a new type of investment I've been dabbling in - affiliate website shares.

I've always been into traditional stocks and crypto, but I came across the idea of investing in shares of affiliate websites, and it piqued my interest. The concept is simple: you invest in a percentage of an affiliate website, and you receive a portion of the site's revenue every month. I figured it could be a nice way to diversify my portfolio and generate some passive income.

So, I took the plunge and invested around $1,000 in a couple of different affiliate websites. To my surprise, I started seeing returns pretty quickly! In the past few months, I've made a couple hundred dollars in passive income from these investments.

I'm still learning the ropes, but I wanted to bring it up in this community to see if anyone else has ventured into this type of investment. I'd love to hear your thoughts, experiences, and any advice you might have. 
Looking forward to hearing your opinions and maybe even sparking some interesting discussions! Cheers!"|0.29|0|0|0
t3_12w913r|1682257180.0|investing|Other cheat codes like real estate in investing?|"I recently bought a duplex

My parents have been urging me to buy a house for a long time now but ultimately the realization that drove me to do it was realizing it's essentially having other people/renters paying off a loan/mortgage for me. To me, I thought of that as a cheat code

I know that others on here definitely think of it this way too

With that in mind, are there other cheat codes like this when it comes to investing in general? Not sure if there's a term for this"|0.31|0|0|0
t3_12w7bw2|1682253763.0|investing|Do you have an investment strategy in the event of UBI (due to AI job replacement)?|"I believe there's a pretty good chance that AI will lead to some sort of UBI, in the next couple of years, due to job replacement (customer service, lawyers, taxi drivers).

Assuming this is true, then there will be big implications in almost every market. 

I personally am considering taking out cash from my apartment and buying gold, holding onto that for a couple years until things clear up a bit. I may also invest in some AI/Robotics funds."|0.12|0|0|0
t3_12w6yma|1682252993.0|investing|"""Don't invest any money you need in 5 years"" is good advice but it's sometimes unclear what it means."|"Suppose you need 200K for a down payment, closing costs, and move-in expenses 6 years from today. Here's a very good rule of thumb ""Don't invest any money you need in 5 years."" How do you apply this rule to this situation? Do you invest the 200K today in an index fund and sell no matter what in 1 year (when you're 5 years out). Do you invest the money today and keep it there for 6 years (knowing that the chances of the market being down over any 6 year period is less than a few percent? 

--

The points above can be made even clear if you're talking about already invested money (but there isn't any real difference because you shouldn't have money invested today that you wouldn't invest today if it was in cash ... assuming no taxes for sake of argument). Suppose the 200K is invested in index funds today and you want to buy a house in 6 years (or college funds etc). Do you keep it in stocks today and sell after 1 year (5 year) or just keep it for the 6 years? 

--

So, how do you interpret this very popular slogan? Cheers."|0.44|0|0|0
t3_12w3n34|1682244610.0|investing|uk investors, US index tracker gpb hedged?|"So to me it seems obvious to go for an etf which has currency hedge, but ive seen a few posts when researching potentials etfs that long term its not recommended. Except the reasoning just seems to be 'itll even out over time' but so what? Why would you take the chance? . I want the index return not a currncy return which may turn out to be a currency loss.

Sure the costs are more. But were talking .15 vs .06 a year. So not  a meaningful argument.

But plse do say if im missing somthing"|0.25|0|0|0
t3_12w20dp|1682240472.0|investing|Daily General Discussion and Advice Thread - April 23, 2023|"Have a general question?  Want to offer some commentary on markets?  Maybe you would just like to throw out a neat fact that doesn't warrant a self post?  Feel free to post here! 

If your question is ""I have $10,000, what do I do?"" or other ""advice for my personal situation"" questions, you should include relevant information, such as the following:

* How old are you? What country do you live in?  
* Are you employed/making income? How much?  
* What are your objectives with this money? (Buy a house? Retirement savings?)  
* What is your time horizon? Do you need this money next month? Next 20yrs?  
* What is your risk tolerance? (Do you mind risking it at blackjack or do you need to know its 100% safe?)  
* What are you current holdings? (Do you already have exposure to specific funds and sectors? Any other assets?)  
* Any big debts (include interest rate) or expenses?  
* And any other relevant financial information will be useful to give you a proper answer.  

Please consider consulting our FAQ first - https://www.reddit.com/r/investing/wiki/faq
And our [side bar](https://www.reddit.com/r/investing/about/sidebar) also has useful resources.  

If you are new to investing - please refer to Wiki - [Getting Started](https://www.reddit.com/r/investing/wiki/index/gettingstarted/)

The reading list in the wiki has a list of books ranging from light reading to advanced topics depending on your knowledge level. Link here - [Reading List](https://www.reddit.com/r/investing/wiki/readinglist)

Check the resources in the sidebar.

Be aware that these answers are just opinions of Redditors and should be used as a starting point for your research. You should strongly consider seeing a registered investment adviser if you need professional support before making any financial decisions!"|0.6|1|0|1
t3_12w1w9j|1682240174.0|investing|Asset allocations across accounts with different tax rules?|"I live in the UK so I have access to an ISA. In an ISA your investments are completely tax free but the amount you can contribute each year is limited. Due to this limit I also have a general account.

Ive decided on a bonds to equities split of 30:70. Should I have the same 30:70 split across both accounts or weight them differently, eg 20:80 in one and 40:60 in the other so the overall split is still 30:70?

I would expect to withdraw from the general account sooner than the ISA as to keep my tax free investments accumulating for as long as possible. As such the time horizon for the general account is shorter than the ISA, so could justify the higher bonds to equities weighting?"|0.88|11|0|11
t3_12vzbz5|1682233541.0|investing|Who audits the auditors to avoid other EY cases?|"Following the [Wirecard](https://en.m.wikipedia.org/wiki/Wirecard) scandal, EY has been banned from some audits in Germany. EY had given Wirecard a clean bill of health for a decade until the company collapsed in 2020.  ""The ban forbids the auditor from participating in tenders for audits of certain companies for two years. This includes all listed companies as well as the majority of the financial sector consisting of banks and insurance companies."" [(Reuters)](https://www.reuters.com/world/europe/german-regulator-hands-ey-2-year-audit-ban-over-wirecard-scandal-handelsblatt-2023-04-03/)
Will this happen again and who is in charge to avoid it?"|0.81|12|0|12
t3_12vxrmf|1682229552.0|investing|T.Rowe Price Investing Options|"Seems like the general consensus on here is to invest through Vanguard/Fidelity and understandably so since I have a personal IRA invested through Fidelity. However, in this case, my employer has recently started a 401k. Unfortunately, my employer does not contribute to our 401k, but I have decided to go through it because it’s still healthier to invest rather than having my money sit in my savings. Every year I still max out my IRA and have my 401k contribution set at 8%. 

The question at hand…is there any T.Rowe Price long-term investing strategy options to follow? I am stumped on which possible options to choose from while keeping my expense low (Boglehead approach)? I am much more familiar with Fidelity and would like to learn more with T.Rowe Price. 

Any insight/ advice would be greatly appreciated!"|0.79|7|0|7
t3_12vwy1f|1682227510.0|investing|Can I use Treasury Bill interest in Tax Loss Harvesting?|"What I understand, Treasury Bill interest is the amount difference from purchase value to face-value. And this interest is reported on 1099-INT. 

If I have some losses in other equities, will the tax-loss harvesting work between that loss and treasury gain?"|0.68|7|0|7
t3_12vsenk|1682216975.0|investing|What happens if the US is late on bond payment?|"Let’s assume the US does hit a technical default… what happens to the bonds that are in people’s investment accounts? Do they just sit there longer than expected? Or do they just zero out and become worthless?

I have about 30 short term treasury bills that ladder out through October. I get about one redemption per week where I usually roll it over into a new T-Bill. If the US can’t make its payment because of the debt limit, what happens on redemption day? When do the bills officially become worthless?"|0.5|0|0|0
t3_12vrn1z|1682215290.0|investing|Is AT&amp;T Stock Worth Investing In? Why Analysts and Insiders Say Yes Despite Q1 Earnings and Market Perception|"I believe in the potential of AT&amp;T's stock and want to encourage investor to consider investing in the company. AT&amp;T is a leading telecom company that provides a wide range of communication and entertainment services to its customers. Despite it's history of having unable to meet public expectations and its poor Q1 earnings, AT&amp;T has many good fundamentals and is a great company to invest in.

One of the most significant reasons to invest in AT&amp;T is that its stock is currently trading below the market average, presenting a great buying opportunity for investors. As of the time of writing, AT&amp;T's stock is valued at $18.22 per share, offering an ideal buying opportunity for investors who want to buy low and potentially earn a substantial return on investment. Furthermore, analysts predict that the stock price will climb by 13%, which could result in significant gains for investors who buy now.

AT&amp;T Labs has also made an industry-first 5G SA Uplink 2-CA data connection in the U.S. to improve upload speeds, and the company has other speed and feature upgrades in the works. This indicates that AT&amp;T is staying at the forefront of technological advancements, which bodes well for the company's future performance.

Moreover, insider movements are positive signs that can boost investor confidence in a company's prospects. In the case of AT&amp;T, insiders have been buying shares of the company's stock, indicating that they have confidence in the company's future performance and prospects.

In conclusion, AT&amp;T is a strong and reliable telecom company with a diverse portfolio of services and a strong revenue stream. The stock is currently trading below the market average, offering an excellent opportunity for investors to buy low. Furthermore, with its recent technological advancements and insider movements, there is reason to believe that the company's stock will perform well in the future. I am a new trader and my DD is on the level of a wallstreetbets bait at best, so investors are encouraged to conduct proper research and analysis before making any investment decisions."|0.2|0|0|0
t3_12vo3vm|1682207389.0|investing|Which will have higher tax benefits: Direct Indexing with tax loss harvesting or investing in an ETF?|"Assuming that fees on both are the same and you are targeting an sp500 index, which would be a more tax efficient way of investing?

1) Direct indexing a portfolio that replicates sp500 and selling off losers each year to tax loss harvest or

2) Investing in an sp500 ETF which can avoid realizing capital gains within the portfolio due to how ETFs redemptions work.

Does anyone have an online tool/software that can do backtests/simulation with tax loss harvesting?"|0.78|11|0|11
t3_12vkq5y|1682200345.0|investing|Investing in corporate bonds|"Looking to learn more about fixed income markets and was wondering about some details. If anyone could answer sone of my questions, would greatly appreciate it!


1. AAPL Corp 2.4 May03’23. Current bid yield: 9.104%. Current ask yield: 4.794%. Closing price: 99.67

So this is a corporate bond for Apple, expiring 03/23 with a coupon rate of 2.4%, paid semi annually. How is there such a high yield when the price of the bond is almost at par value, and there is no risk of default? 
What does the bid yield actually tell you, if not the expected return you’d make?

In a more general view of bonds, is it the current bid yield which determines the annual returns, assuming you hold till maturity? 

Also, if you believe interest rates are going to go down, am I right in thinking bonds will rise in value? Is there a way of calculating how much they can/will rise in value or is it completely supply and demand 

Thanks!"|1.0|7|0|7
t3_12vjq1c|1682198400.0|investing|Inmates Running the Asylum: Low Quality Articles on Investing and Stock Picking by Journos Pretending to be Investment Analysts|"[https://finance.yahoo.com/news/3-warren-buffett-stocks-buy-103034245.html](https://finance.yahoo.com/news/3-warren-buffett-stocks-buy-103034245.html)

We know that journos are not financial analysts nor should they pretend to be. But they continue to do so with impunity. There are so many low-quality articles being written on investing and stock-picking that sometimes you feel compelled to refute them.

The above-linked article in InvestorPlace was carried by YahooFinance and came to my attention. It's a short piece on Buffett's stock picks written by a journo masquerading as some kind of stock picker. Once you examine the article and the places he's worked at, it's immediately obvious that this is a liberal arts major with no financial training who is clueless about financial statements and market data.

The article starts out by opining that Buffett bought many cyclical stocks in 2022. Then he opines that investors should ""emulate the Oracle of Omaha and snap up"" 3 Buffett stocks which may outperform the market. The stocks he has in mind are (1) Bank of America (BAC), (2) American Express (Amex), and (3) Louisiana Pacific (LPX). Let's just examine BAC since it will take too much effort to refute all three and waste time on this imbecile.

Regarding BAC, the journo notes it's trading at $27.90 (at the time) which is ""unjustified"" as BAC is a large bank that will ""benefit from deposit inflows because of worries about smaller banks."" BAC is large so will attract deposits from smaller, regional banks. So he observes BAC's earnings will rise from $3.19 in 2022 to analysts' estimate of $3.39 in 2023. Well, here's the problem: first, that's a modest 6.4% EPS growth year over year and that's good. But $3.39 is also the estimate for 2024. In other words, analysts are projecting no earnings growth from 2023 to 2024. Why do you think that's the case? That's because they expect no revenue growth from 2023 to 2024: in fact, they are projecting a revenue decline from $100.93b to $100.89b. In other words, they are projecting a standstill scenario for BAC which is more than likely a modest banking recession taking place near-term. Btw, this isn't some secret that is being guarded by the keepers of Bank America's flame: this can be gleaned from any public site like YahooFinance compiling analyst estimates:

[https://finance.yahoo.com/quote/BAC/analysis?p=BAC](https://finance.yahoo.com/quote/BAC/analysis?p=BAC)

But you would not know this from the misrepresentation that earnings growth is impressive and that, given this growth, the stock price is ""unjustifiably"" low.

Let's dig deeper into this misleading claim the stock price is ""unjustifiably low."" Since this journo can't do research himself, he quotes other financial sites and claims BAC has dropped below $30 “for the first time since 2020, as Barron's cited.” I don't think he even looked at the graph himself, which should have been part of his due diligence. BAC dipped below $30 in January and February of 2021: that is, the closing prices registered were lower than $30 on at least 3 trading days during that span; intraday-wise, BAC's stock price was below $30 on at least 6 days out of the first 20 trading days in 2021. I know, because I used to watch BAC.

[https://finance.yahoo.com/quote/BAC?p=BAC&amp;.tsrc=fin-srch](https://finance.yahoo.com/quote/BAC?p=BAC&amp;.tsrc=fin-srch)

Then, BAC rose to a high of $49.38 in Feb 2022, which may have given impression that BAC was flying high and anything below $30 is abnormal. But this is how cyclical stocks, which banking stocks are, often behave, even a Systemically Important Bank (SIB) such as BAC.

Plus, when the journo claims the price dropping below $30 is so unprecedented, he implies that BAC must have been trading well above $30 for much of the last 5 years. That is not so either. Except for the 15-month period between March 2021 and May 2022, BAC traded in the low 30s. Prior to 2021, the stock was even under $18 and opened and closed below $20 in March and April of 2020 -- that was only 3 years ago. BAC was indeed a low-20 stock for much of 2020. That's what you call cyclicality and happens to even the largest commercial bank in the world.

Notice the guy doesn't cite financials since he can't. So he focuses instead on market data and graphs but even gets that part wrong. Remember when there was a tech wreck in 2000 (not 2020): that's when journos started masquerading as analysts and started touting Internet stocks like CMGI and coined terms like B2B, B2C, ""killer apps"" and ""category killers.""  It's been more than 20 years. But the same thing is happening again. It doesn't matter whether you like or don't like Buffett's stock picks. The same journos are churning out low-quality articles replete with misinformation and are passing themselves off as analysts. The inmates are running the asylum again."|0.94|192|0|192
t3_12vh093|1682192832.0|investing|Market Cap + Dividend strategy, would this work?|"Hi everyone

**I. Disclaimers:**

1. I'm rather new to this sub and investing in general, and English is not my first language. This thread may be totally nonsensical and I am sorry if it turns out to be. But I hope to receive constructive criticisms because I wish to learn more from you guys.
2. I have a very limited coding background so I couldn't run a backtest on this strategy that I am proposing. I am hoping if you guys could help me verify if this investing strategy would have worked in the past.
3. Before I start, I have tested against SPY, SCHD and QQQ for a period of 2015-2023 on portfolio visualiser and my strategy seems to work. But the test wasn't extensive as I couldn't have a dynamic data to rebalance the % overtime, it would be a bad idea as I found out NVIDIA was not among the top LargeCap but they climbed tremendously over the past few years.

&amp;#x200B;

**II. Short hand notations:**

1. I will use basic short forms like **DCA**, for this post it would simply mean I invest **however much I could at the end of each month**, after sorting out other aspects of my finance.
2. Another set of short forms is LC for Large Cap, TLC for Top Largest Cap, **T1LC** is the **Top 1 Largest Cap**, T2LC for the Top 2 Largest Cap, and so on.
3. Suffice **wD** would mean **with Dividend**. T1LCwD would mean the Top 1 Largest Cap company that pays Dividend.
4. Prefix **a** would mean adjusted. I will introduce this concept in **III.A.** right below.

&amp;#x200B;

**III. So here is the strategy:**

**A. Rules and Criteria:** (I am probably using Excel to manually do this, please let me know if there is a better way. I really regret not taking my 3 years of uni Statistics seriously.)

1. I would update the data every month before the event I mentioned in **II.1**
2. I would take the Current Market Cap Total \* (1+DividendYield%) to get Adjusted Current Market Cap Total for each stock.
3. Sum up the Adjusted Current Market Cap Totals.
4. Find out the % weightage of each stock.
5. Resort them if needed. T1LCwD may not be the same as aT1LCwD because of the multiplication factor in 2.

I will explain deeper in part **B** (and even reset the rules because I don't have a large sum of money to buy all of these stocks).

*Note:*

1. *As aT1LCwD may cause confusion, I will sometime use* ***T1*** *instead.*
2. *I choose stocks wD because I noticed that these are relatively more stable than stocks woD, please counter me if it's dangerously wrong.*
3. *Even in bad crises, yeah you know the rest.*

**B. Algorithm:** (This is a crude skeleton of the plan, I will ignore trading fees for the time being)

1. I will buy 1 T1.
2. a. If buying a T2 will exceed the holding % than 1 T1 %, I will buy 1 more T1 and come back to Step 2.  
b. If buying 1 T2 does not set my T2 at a higher holding % than my T1, buy 1 T2 and proceed to Step 3.
3. Iterate the steps for T3 and continue until my deposit depletes.
4. In the next month, check if there is any changes to the % on Excel, and carry on the algorithm.

&amp;#x200B;

**IV. Additional takes:**

1. The math in **III.A.2** can be modified using Machine Learning to optimise the model. Again I really regret not taking my stats course seriously so I can only use wishful thinking here.
2. This idea is completely opposite to the mean-reversion DCA strategy, where you invest monthly in an index, a bit more when the price drops, a bit less when the price increases. This was shared with me by a friend who I deem very smart and quite knowledgeable. But I find happiness in creating new ideas.
3. This is somewhat a self-correcting algorithm, in the case a new company is rising, it would include and increase the position. The companies that fall off will not yet be sold, they may bounce back.
4. I am aware that Fundalmental &gt; Technical and I should spend more time reading up financial reports and news.  I understand that, but I want to focus more time on my other aspects in life as the time goes by.
5. For some reason, when I tested with JNJ and it seems to be not too effective with this Dividend King. I will update on this if I can think of a reason why."|0.25|0|0|0
