name|created_utc|subreddit|title|selftext|upvote_ratio|ups|downs|score
t3_11xsmet|1679429103.0|investing|TD Bank &amp; First Horizon Deal - Question about disclosure in Qtrly Statements|"Hello all,

In light of all the recent developments in the banking sector I wanted to see if someone here can help decipher some wording from the latest TD Bank (Ticker: TD) quaterly statements as it relates to a disclosure about their pending acuisition of First Horizon Corp (Ticker: FHN).

There is some wording around the mark-to-market of interest rate swaps that I can't quite get my head around and I'm hoping someone more familiar with the accounting and transactions of this type might be able to offer an opinion on just what is being captured.

The relevant section is from this document: [https://www.td.com/document/PDF/investor/2023/2023-Q1\_Earnings\_News\_Release\_F\_EN.pdf](https://www.td.com/document/PDF/investor/2023/2023-Q1_Earnings_News_Release_F_EN.pdf)

Page 5 has the relevant information under the heading ""Pending Acquisition of First Horizon Corporation"" it has this text (my emphasis):

""The fair value of First Horizon’s fixed rate financial assets and liabilities and certain intangible assets are sensitive to interest rate changes. The fair value of net assets will determine the amount of goodwill to be recognized on closing of the acquisition. Increases in goodwill and intangibles will negatively impact capital ratios because they are deducted from capital under OSFI Basel III rules. In order to mitigate this volatility to closing capital, the Bank de-designated certain interest rate swaps hedging fixed income investments in fair value hedge accounting relationships.

Since the de-designation, mark-to-market gains (losses) on these swaps are recognized in earnings, without any corresponding offset from the previously hedged investments. Such gains (losses) will mitigate the capital impact from changes in the amount of goodwill recognized on closing of the acquisition. The de- designation also triggered the amortization of the investments’ basis adjustment to net interest income over the remaining expected life of the investments.

**For the three months ended January 31, 2023, the Bank reported ($998) million in non-interest income related to the mark-to-market on the swaps, and $122 million in net interest income related to the basis adjustment amortization. In addition, for the three months ended January 31, 2023, the Bank reported $251 million in non-interest income related to the net interest earned on the swaps.**

Based on the estimated financial performance and balance sheets of the Bank and First Horizon, including transaction-related impacts, the Bank expects that its Common Equity Tier 1 (CET1) Capital ratio will be comfortably above 11% upon the closing of the First Horizon acquisition.""

Q - So the question is, did they write down \~$1 Billion in the mark-to-market on the interest rate swap acquisition costs, is that correct?  And if so, does this suggest that they were holding a significant amount of long dated, low interest rate bonds and had to unload them at a substantial loss?  Just trying to understand exactly what this may be telling us."|0.74|20|0|20
t3_11xsdsx|1679428642.0|investing|How Does Selling Brokered CDs Work - Accrued Interest?|"I have some old brokered CDs with low interest rates. If I sell them before maturity on the secondary market do I get paid their accrued interest up to the sale date? I just sold some and it appears that accrued interest is paid.

For example:

I sold a $25K, 2.05% one year CD with 5/25/23 maturity date. It was reported at my broker as:

Sold 25 @ 99.026  with proceeds of the sale $25,180.54

25 x 0.99026 = $24,756.50

Does the difference between $24,756.50 and $25,180.54 ($424.04) mean that I was paid accrued interest. That is my guess.

If this is the case, that means that I can treat them sort of like no penalty CDs - plus or minus capital gain or loss due to interest rate changes.

I web searched about this and did not find anything.

I don't see a way to start a new topic in the daily section. Move this there if appropriate."|0.46|0|0|0
t3_11xp5g7|1679422240.0|investing|HYSA, CDs, Treasury Bills using Unused Student Loans during medical school (no interest accumulating yet)|"I’m a first year medical student and every semester we are able to take out additional loans to cover living expenses. I have done that for both semesters and thankfully because my wife works we have not dipped into those loans near as much as we thought we would. In the future, I don’t plan on taking out additional living expenses loans.

I want to keep what I have already taken out as a safety cushion for anything that can happen (we also are almost done with our 6-mo emergency fund, separate from the loans). In the meantime, I was wondering about investing the loans into CDs, HYSA, or T-Bills to earn interest off of the loans with minimal-risk, rather than put any of it into the stock market.

I have considered doing a CD Ladder or T-bill ladder since their rates are great right now. Should I take interest I earn from those and put that into the stock market? Thoughts on that? Or thoughts in general on which of the three options or other ones you can think of) would be a great, safe place to store and make use of the extra loan money.

Thanks!"|0.66|7|0|7
t3_11xofxr|1679420854.0|investing|Next potential Google stock dip?|"Hey everyone,

As you may know, Google recently launched its new AI language model, Bard, which has created a lot of buzz in the tech industry. However, there are concerns that this new release could negatively impact Google's stock in the near future.

A few weeks ago, Google's stock experienced a dip after a demo of its AI technology got one of the questions wrong. Now, with the release of Bard, investors might be feeling uneasy about what this means for the company's financial future.

According to Google's FAQ, Bard is currently facing a few issues that might affect its performance in the market. Firstly, it's unable to keep track of context, which is a major limitation when it comes to generating coherent responses. Secondly, Bard can't write code, which is a significant setback for a company that's trying to automate as many processes as possible.

While Bard is an exciting development for Google and the tech industry at large, investors may want to keep an eye on the company's performance over the next few weeks to see how the market responds to this new release. It's important to note that Google has a solid track record of innovation and success, so it's likely that they will find ways to address these limitations in the future.

What are your thoughts on Google Bard's impact on the company's stock? Are you planning on investing in Google anytime soon? Thoughts?

https://bard.google.com/faq"|0.26|0|0|0
t3_11xlv2l|1679415758.0|investing|Maryland 529: Global Equity Market Index Portfolio|"Hi everyone,

First time poster, so apologies if I'm missing some crucial information--please just let me know. 

I'm about to open a 529 for our baby who is due in May. Given our long time horizon and that we only intend to have one child, I have a good stomach for risk and am interested in a fixed vs TD portfolio with a healthy mix of domestic &amp; international exposure. I've been reading the advice in this sub and from what I can tell, is there any reason to not park everything in Global Equity Market Index Portfolio (details here: [https://maryland529.com/Portals/0/Files/MCIP\_Disclosure\_Statement.pdf](https://maryland529.com/Portals/0/Files/MCIP_Disclosure_Statement.pdf), fund description page 36). It seems to have healthy exposure to 500, mid &amp; small cap domestics, plus about 30% to developed market international. Fees seem reasonable at .22%.  I also considered an 80/20 split of the Equity Index 500 and Extended Equity index, but then that leaves me with no international exposure as far as I can tell, because the Global Equity Market Index already includes investment into the 500 portfolio, which would be redundant. 

I know just enough about this to be dangerous, so all feedback is welcome."|0.65|10|0|10
t3_11xl5se|1679414409.0|investing|Are banks the riskiest stocks to own?|"It seems to me like banks are the riskiest stocks to own. They may feel ""safe"" because a lot of these companies are so identifiable with their physical brick and mortar branch offices and nice logos that make you feel warm and fuzzy inside but are these not the most dangerous places to invest? Look at SIVB, just a year ago flying high and now at $0. Nobody would have said a year or two ago that SIVB was a risky investment (certainly not riskier than Bitcoin) and yet you would have lost 100% of your money in 1 year with virtually no warning - turns out your money was safer at your favorite shitcoin. And there appear to be many other potential regional banks on the chopping block as well.

We also don't have to look too far back for more examples...Washington Mutual, Bear Stearns. And if the banks didn't totally collapse they probably faced other crises that wiped out most shareholder equity (2008 crisis has entered the chat).

What other kind of company can plummet to zero literally overnight? Tech companies usually have moats or at least patented technology that has some intrinsic value...when they fail it's usually a slow burn that you can see coming over multiple quarters/years (blackberry, yahoo, AOL, blockbuster), displaced by other smarter players for good reason. Then there's more traditional companies like Walmart, Chipotle, Starbucks, McDonald's, Costco...hard to see any of them plummeting to zero overnight short of some kind of fraud situation. Even biotech stocks aren't as bad...though they can certainly plummet to zero overnight, they aren't widely regarded as ""safe"" investments and investors know what they're getting into.

It just scares me to invest in a company that is essentially a black box, no matter how safe it may seem, the management levers up to the tits and if the wind briefly blows the wrong way (in this case the fed raising interest rates quickly - which was widely expected following hot inflation reports), you lose 100% of your money very rapidly. Or not, maybe everyone just gets spooked and decides to withdraw their funds despite the bank being health otherwise, and you still lose all your money - quickly.

What do you guys think?

EDIT: To everyone downvoting me I'll just leave this here [https://pbs.twimg.com/media/Fq3kkS1WAAMnx0s.png](https://pbs.twimg.com/media/Fq3kkS1WAAMnx0s.png) good luck"|0.34|0|0|0
t3_11xl1wz|1679414197.0|investing|Persistent inflation plays|"It looks like the Fed is going to hike by 25bps or not hike at all tomorrow. If financial stability issues continue to mount, whether the Fed continues to hike through EOY 2023 becomes really doubtful. But inflation is still persistent and seems likely to double dip later in the year as cooling energy prices rebound and core CPI remains elevated.

So if the Fed is between a rock and a hard place w.r.t. hiking causing too much pain but inflation being persistent, it seems plausible they might just sacrifice fighting inflation in the medium-term of 1-3 years, or more permanently re-evaluate their framework and raise their inflation target to 3 or even 4%.

The purpose of this discussion is to strategize about the best plays to capitalize on an entrenchment of inflation expectations well above 2% over the next 1-2 years. The basic answers are commodities, gold, crypto, hard assets etc. And those are good hedges. But going into the initial 2021-22 inflation spike the targeted fed/inflation trade was shorting treasuries because their value was directly tied to a continued low-yield environment which rapid fed rate hikes threatened (and I may have made a cool few grand off that insight). But are there similarly targeted trades available under this new set of circumstances (short of buying contracts on prediction markets for YoY inflation rates in 2023 and beyond)? Perhaps CPI futures where they exist?

Thank you for reading."|0.51|1|0|1
t3_11xkwh5|1679413895.0|investing|As an individual investor, what risk do I have if my broker goes under?|"SIPC coverage limits are $500k per investor. Suppose I have more than that amount at Schwab. According to [their website](https://international.schwab.com/account-protection), they have excess SIPC coverage protecting individuals for up to $1.15M in cash and $150M in investments. So you'd think that has me covered.

But then they also say their policy ""provides protection up to an aggregate of US $600 million"". This seems to suggest to me that if Schwab were to go under, just four individuals with a 9-figure net worth would wipe out the insurance coverage for the rest of us. (This interpretation was validated by a Schwab customer service rep.)

I assume the money would be distributed proportionally across investors (or maybe even progressively in favor of smaller investors?), but the point is that $600M pales in comparison to schwab's $100B market cap or $7T assets under management.

So I wonder:

1. What are the realistic scenarios in which SIPC or excess SIPC coverage might be needed?

2. What is the likelihood of experiencing an event significant enough to require SIPC or excess SIPC coverage, yet not so significant that it wipes out the $600M limit? More to the point, **is excess SIPC coverage only for appearances?**"|0.9|398|0|398
t3_11xkql7|1679413575.0|investing|Safely investing my emergency fund|"I was looking to maximize my emergency fund that I currently have sitting in an high interest savings account (3.6%) at Ally bank by moving my money back and forth between that account and a higher paying no penalty CD (4.75%) account. 

So the savings account pays monthly, the idea is to have my money and gain the savings account monthly interest payout. After which I would open another CD account and start collecting daily interest from the account until it was time to move it back into my savings account. 

Was wondering if anyone has ever went through the hassle of double dipping back and forth trying to maximize interest gained on the same money. 

Anyone have experience with doing this?"|0.44|0|0|0
t3_11xjtcc|1679411685.0|investing|Chapter 11 bankruptcy, proof of claim as equity shareholder (proof of interest)|"A company of which I am a shareholder entered into chapter 11 bankruptcy.

It’s an odd situation as this is looking more and more like they are the rare 10% that will actually emerge from it.

I have received a letter from my broker on behalf of stretto regarding the filing of a proof of claim. I thought this would be for creditors rather than equity holders.

Online it says equity holders can file a “proof of interest” but I cannot find a way to do this only to file for “proof of claim” as per the letter.  

Proof of claim doesn’t really make sense at all to me, what would I claim? The dollar value I paid for the shares? The value of the shares as of the date of bankruptcy filing?

My main focus is to make sure that in the event the company finds a way to continue either with its existing shareholder structure or a new one that I am able to retain my fair shareholding as per the agreements they make.

Thank you in advance for any advice you might have."|0.62|3|0|3
t3_11xjccj|1679410723.0|investing|Hustle Fund - Angel Squad - Investing into startups with $1000|Has anyone had any experience with Hustle Fund's Angel Squad - Invest with as little as $1000 in startups for $3500 (one time over 4 months)... I just started looking into them but wanted to see if there are others on this forum who have any experience with them and their journey....|0.3|0|0|0
t3_11xhpiz|1679407170.0|investing|Retail investor statistics?|"Hello all! 

I am doing a small research about the behaviour of retail investors. However, I find it hard to find any reliable statistics of for example the amount of retail investors in a certain market or globally, the preferred financial instruments etc etc. 

Is there any well-known sites that provides these (free) or should I use the services subject to charge? 

Thanks in advance."|0.33|0|0|0
t3_11xhjpi|1679406798.0|investing|Anyone ever hear of or invested in Toyota IncomeDriver Notes?|I was looking at my car financials and then I stumbled upon IncomeDriver Notes. I can't find much of what they do online. So I was wondering if anyone here has ever heard of or invested in them. They are no FDIC insured either and seem to have. pretty decent rates. TIA!|0.72|21|0|21
t3_11xh549|1679405865.0|investing|T-bill auctions scheduled for tom. before rate announcement, unavailable for purchase|"Currently multiple bills* are supposed to be available for purchase (vanguard) but are not. Auction slated for midnight tonight (per Vanguard). Is it possible that this weeks bills are being delayed until after rate announcement? Seems odd to me that I can’t purchase this morning.
*4, 8, 17 week T-Bills"|0.67|4|0|4
t3_11xh2oa|1679405712.0|investing|company is changing having meeting for new 401k|"or we could choose similar or same fund as we had previously. do you think i should stay in target date fun (im 36) or ask the guy to put me into a Precious Metals fund? 

thanks. i own precious metals already, and company match 6% for 401 which ive been doing for 20 years...but the 401k stocks are down quite a bit. like $35k instead of $50k + it should be if the markets werent so bad

&amp;#x200B;

i also have an IRA aside from metals (gold silver physical, stocks) but the stocks in the little IRA are terrible. used to be like $8k but its about $3k now

&amp;#x200B;

thanks

 

i saw these options

## Allspring Precious Metals Fund

 

## Fidelity Select Gold Portfolio Fund

 

## Gabelli Gold Fund"|0.4|0|0|0
t3_11xbigy|1679389270.0|investing|Daily General Discussion and Advice Thread - March 21, 2023|"Have a general question?  Want to offer some commentary on markets?  Maybe you would just like to throw out a neat fact that doesn't warrant a self post?  Feel free to post here! 

If your question is ""I have $10,000, what do I do?"" or other ""advice for my personal situation"" questions, you should include relevant information, such as the following:

* How old are you? What country do you live in?  
* Are you employed/making income? How much?  
* What are your objectives with this money? (Buy a house? Retirement savings?)  
* What is your time horizon? Do you need this money next month? Next 20yrs?  
* What is your risk tolerance? (Do you mind risking it at blackjack or do you need to know its 100% safe?)  
* What are you current holdings? (Do you already have exposure to specific funds and sectors? Any other assets?)  
* Any big debts (include interest rate) or expenses?  
* And any other relevant financial information will be useful to give you a proper answer.  

Please consider consulting our FAQ first - https://www.reddit.com/r/investing/wiki/faq
And our [side bar](https://www.reddit.com/r/investing/about/sidebar) also has useful resources.  

If you are new to investing - please refer to Wiki - [Getting Started](https://www.reddit.com/r/investing/wiki/index/gettingstarted/)

The reading list in the wiki has a list of books ranging from light reading to advanced topics depending on your knowledge level. Link here - [Reading List](https://www.reddit.com/r/investing/wiki/readinglist)

Check the resources in the sidebar.

Be aware that these answers are just opinions of Redditors and should be used as a starting point for your research. You should strongly consider seeing a registered investment adviser if you need professional support before making any financial decisions!"|0.83|11|0|11
t3_11xb35k|1679387665.0|investing|Fixed Income Strategy to Avoid Withholding Taxes?|"Hello,

I'm a non-US resident/citizen. I want to invest and expose myself to short term treasuries. So far I've done this by purchasing $SHY. However, I noticed that my payouts on this product are subject to US withholding taxes, which ends up being about 25% of the overall payout.

I am wondering what alternative ETF or strategy that I could use to have similar exposure to US treasuries, without being subject to withholding tax. Please let me know!"|0.55|1|0|1
t3_11xb1uk|1679387521.0|investing|Feds plan for bail ins failed|Many won’t realise that after the GFC 2008 government changed laws to allow banks to bail in your deposits , swapping them for equity in their bankrupt bank . The fed just realised that if it actually allowed SVB to do this , all banks would be ruined as we depositors fled, took our money out , of every bank seeking safety . Instead of properly sorting out the too big to fail banks they tried to put our savings at their disposal when they screwed up .|0.24|0|0|0
t3_11xaofh|1679386564.0|investing|Currency risk management by buying US equities in European Stockmarkets.|"Could someone please tell me if my thinking is correct? 

At this moment I own APPL stock listed on the NASDAQ in USD.  I believe the dollar will weaken within the next 2 years as the ECB continues to increase interest rates. If I sell by NASDAQ listed AAPL stock and buy Apple stock listed on Xetra (German Stockmarket) in EUR, would I be gaining from any gains in that stock without losing from any weakening in USD?

I have read a lot online about hedging against currency risk, but no one seems to put this forward as a way, and am doubting wether my thinking is correct."|0.38|0|0|0
t3_11x8goi|1679378644.0|investing|How long do you think it'll be before an AI will be able to crush the stock market?|"As we know, or at least, ""know"", the gold standard for investing is generally accepted to be putting your money in the S&amp;P 500, long-term, and just leaving it there for decades.  The S&amp;P 500, represented by mutual funds such as VFIAX or exchange traded funds like VOO or SPY, will - **on average** \- gain about 10% per year.  

How long will it be until an AI figures out investing sufficiently to consistently do better than the S&amp;P 500?"|0.23|0|0|0
t3_11x5nul|1679369722.0|investing|For Those Over FDIC (or SIPC) Limits, What's Your Strategy?|"For those who have assets over the FDIC limit (or SIPC in brokerages) what is your strategy?

Are you spreading things out to different banks? Finding a bunch of high interest yield banks to spread out to? Trying to create more types of brokerage accounts for broader SIPC coverage? Buying up different hard assets?

Or maybe just don't care, or no fear? Trust that the system is fine? Perhaps just feel excess SIPC have you covered?

Curious to hear different strategies and opinions. Particularly **why** that strategy, bank(s), or institution(s)"|0.8|69|0|69
t3_11x4h14|1679366411.0|investing|Private placement program|"PPP or Managed buy/sell program? 

I’ve been approached by 2 or 3 companies who have been telling me about this PPP or managed buy and sell program.

Does anyone know anything about it? Has anyone every done one successfully? 

Minimum investment of 500k as a JV with a non-depleted account. Meaning money is not at risk. The money is then pinged to the trader who uses that to release money from bank to trade MTNs. The trades are through bank assets bought and sold at pre-determined price. Return 15-25% a month.

The second one was 1mil minimum, need to provide proof of funds and bank manger sign off. The money stay in my bank and is blocked for 40 banking weeks. The returns are 10-15% a week. 

When I first heard the returns I just through here we go more bullshit. But when I look online these things seem to exist and seem to involve lawyers. I’ve also read some saying it’s a scam.

Has anyone got any proof it work? Anyone who actually works in bank can confirm this?"|0.5|0|0|0
t3_11x3bkr|1679363419.0|investing|Should I quit while I'm ahead and go to 100% cash or what do you think in this market? Or do you just ride the waves and go long?|"I know it's not right to try and time the market but since being down 30% from my ath in November 2021 I've recovered about half my losses.

I realize that lately we've been in a sort of bull mode and I'm still about 30% cash.

I'm wondering though if I should just pack it in and go maybe 80% cash or something with the premise that I think eventually we'll sell off to sp500 3000 some time in the future?

Or is 30% cash enough if we were to sell down to 3000 etc?

What do you folks do?

Do you just ride the waves and keep dcaing mostly no matter what?

Do you keep.any cash percentage?

My cash percentage is not out of fear of loss mostly but of hopes that I could possibly double my money eventually if we sell off enough or at least get in at a lower basis.

It seems lately that a lot of people on.cnbc are becoming bearish again.

Thanks"|0.27|0|0|0
t3_11x069v|1679355628.0|investing|United Airlines - stock dropped over 20% - buy the dip|United's (UAL) stock dropped over 20% on lower guidance for Q1. However, UAL gave positive guidance for Q2 and the rest of the year. UAL's EPS estimates for the full year remain at $10 to $12 based on strong bookings. As a result, the dip looks like a buying opportunity in my opinion.|0.4|0|0|0
